,title,description
199,Baijiu,"Chinese, clear, white, liquor, other, be, southeastern, employ, glutinous, use, lacryma-jobi, qū, starter, pulverized, appear, similar, several, Asian, Japanese, Korean, dark, ==, resemble, current, solid-state, simultaneous, typical, baijiu, small, drinkware, traditional, drink, own, medicinal, ==, inexpensive, same, many, command, popular, wide, regional, distinctive, culinary, third, nationwide, various, aroma.The, major, overwhelming, strong, light, following, direct, fragrant, bold, bean, sorghum, Western, sauce, large, layered, umami, delicious, perfect, fine, known, nóngxiāng, distilled, sweet, unctuous, mellow, gentle, high, ethyl, supposed, Other, notable, qīngxiāng, dry, delectable, clean, give, dried, floral, primary, èrguōtóu, such, rice-based, little, aromatic, fèngxiāng, rattan, strong-aroma, mud, sauce-aroma, nutty, fat, fermented, savory, separate, pit-fermented, Extra-strong, fùyùxiāng, big, Special, tèxiāng, lǎobáigānxiāng, Similar, light-aroma, wheat-based, common, ===, second, blue-collar, northern, northeastern, commonly-drunk, Red, gāoliángjiǔ, old, Three, local, famous, herbal, double-distilled, triple-distilled, rice-aroma, foreign, flourish, able, Luzhou, unique, due, renowned, Liulingzui, special, first, Time-honored, southern, raw, Five-Grain, brew, drunk, drunkard, western, produce, ancient, Panama-Pacific, enough, solve, authentic, red, agricultural, exceptional, hand-crafted, Cantonese, steamed, Jian, dynasty, so-called, Liquor-making, rare, underground, natural, weak, alkaline, mineral, excellent, pure, Popular, crystal, osmanthus, bamboo-leaf, green, bamboo, yellowish-green, mei, Imperial, twenty, royal, tea, recent, hawthorn, oolong, oolong, black, available, chajiu, alcoholic"
200,Beef brisket,"precise, superficial, deep, have, collar, significant, connective, resulting, be, tenderize, costal, ==, many, tough, due, fat, left, keep, prolonged, necessary, break, gelatin, Popular, indirect, such, pecan, hickory, added, other, main, certain, burnt, finished, popular, make, open-faced, white, traditional, main-course, slow, three-pound, whole, meat-cutting, North, American, photographic, retail, lean, first, flat, second, triangular, ==, Other, long, indigenous, southern, synonymous, there.In, Jewish, Ashkenazi, Montreal-style, smoked, close, low, curry.In, Korean, aromatic, heavy, full, soy, sauce-based, preserved, match-length, complete, cook, thin, hot, prepare, suea, rong, grilled, seasoned, green, amongst, common, Vietnamese, low-cost, lidded, casserole, dish, Good, Italian, bollito, typical, national, dark, German, small, steak, 1-931686-79-3, External, dictionary"
201,Beggar's Chicken,"Chinese, low, single, take, prepared, ceramic, ==, popular, many, clay-wrapped, slow, old.Various, packed, open, aromatic, other, mud-hole, avoid, attract, imperial, dine, childhood, ==, non-toxic, retain, various, be, outdoor, Non-toxic, pay, much, crack, dangerous, expensive, purchase, oven, domestic, eliminate, cover, dish, cook, ready, electric, simplified"
202,Bingtang hulu,"traditional, Chinese, candied, regular, sugary, popular, northern, sweet, sour, eat, southern, available, large, such, hard, common, mean, sugar, bottle, slight, recent, various, other, red, ==, =="
203,Bitter melon,"colloquial, bitter, balsam-pear, tropical, subtropical, edible, many, Indian, 14th, ==, Alternative, other, few, herbaceous, tendril-bearing, simple, alternate, separated, separate, yellow, female, distinct, oblong, hollow, thin, flesh, central, large, flat, green, turn, crunchy, similar, cucumber, chayote, green, white, unripe, be, common, change, bitterness, Chinese, slight, sweet, red, uncooked, popular, Asian, ripe, expose, bright, ===, cultivar, pale, undulating, warty, typical, pointed, jagged, triangular, intermediate, bear, stuffed, sub-continent, Culinary, early, young, dim, herbal, gohyah, North, offset, such, mixed, grated, stir-fried, theeyal, roasted, medicinal, Other, deep-frying, pachi, fried, special, sour, kattu, chopped, different, crispy, northern, tite, fresh, eaten, golden-brown, own, karawila, main, rural, turmeric, whole, unpeeled, cooked, minced, hot, Japanese, significant, Indonesian, various, Christian, Vietnamese, raw, khổ, dried, Bitter, stewed, prepared, clear, garlic, fish, small, mara, wild, nutritious, dish, lima, regional, little, bagoong-based, sautéed, scotch, African, long, traditional, claimed, stomachic, laxative, antibilious, emetic, anthelmintic, purported, potential, clinical, further, recommend, several, menstrual, scientific, back, preliminary, benefit.With, animal, small-scale, human, hypoglycemic, concentrated, juice, efficacious, multiple, decrease, beneficial, depend, verify, abdominal, freshly, available, Adverse, side, urinary, mild, require, resolve, pregnant, induce, culinary, commercial, make, good, dieuretic, Medicinal, Native, ==, West"
204,Bubble tea,"Bubble, bubble, boba, Chinese, 珍珠奶茶, Taiwanese, tea-based, optional, such, chewy, Ice-blended, frozen, slushy, many, wide, popular, black, green, ==, oolong, come, teas, condensed, fresh, non-dairy, sell, Asian, fruit-flavored, hot, available, small, 糖漿, Many, common, cold, prevalent, original, unknown, tapioca, different, fruit, be, oolong, tea, plastic, authentic, seal, latter, serving, spill-free, ready, drink, oversize, straw, large, allow, pass, refer, zhēn, short, English, overseas, former, other, ===, have, white, Decaffeinated, Other, include, blended, add, similar, due, Green, traditional, rectangular, bean, typical, give, added, red, cheese, top, whipped, offer, snow, slushie-like, iced, cause, harden, difficult, suck, prevent, so-called, mixed, brown, purchase, alternative, Japanese, tea, new, multiple, rapid, fen, boring, top-selling, foreign, high, contemporary, cultural, major, direct, appropriate, literal, non-Chinese-speaking, create, warm, light, same, well-shaken, modern, pearl, logical, first, nǎi, layered, frothy, top, hence, salty, recommended, potential, make, affect, instructed, stop, look, allergenic, German, representative, issue, second, free, cancer-causing, contain, excessive, heavy-metal, health-threatening, unapproved, own, additional, starch-based"
205,Century egg,"Chinese, preserved, hundred-year, thousand-year, thousand-year-old, black, several, grey, creamy, strong, due, white, dark, translucent, alkaline, complex, flavorless, flavorful, pine, pine-patterned, ==, likely, preserve, similar, Western, verifiable, have, shallow, slaked, produce, improve, present, traditional, aforementioned, primitive, mixed, smooth, protect, keep, cloth-covered, ready, ===, modern, many, raw, table, achieve, same, toxic, unscrupulous, essential, excessive, lead, copper, finished, be, further, own, pickled, Shanghainese, chilled, popular, eat, sliced, cold, sesame, Japanese, recipe, common, northern, slice, soft, liberal, shredded, young, light, taste, old-and-fresh, chopped, top, fresh, Taiwanese, small, cook, create, lean, main, Peeled, seasoned, marinated, salted, congee, special, first, julienned, quartered, avoided, good, support, basic, horse, urine, distinctive, urine-like, ไข่เยี่ยวม้า, ໄຂ່ຍ່ຽວມ້າ, speed, turn, increase, rampant, label, Lead, Many, industrial, arsenic, lead, other, heavy, make, lessen, provide, encourage, regulate, combat, bad, Unlocking, 978-981-00-0454-5, Make, External"
206,Cha siu,"Chinese, Cantonese, popular, flavor, prepare, ==, char, vary, few, main, common, marbled, jyu, traditional, long, seasoned, covered, ancient, wild, other, available, make, modern, domestic, five-spice, red, bean, dark, optional, exterior, similar, American, be, give, characteristic, chasiu, fast, various, complex, ==, white, independent, per-person, commonly, whole, many, vegetable, Southeast, Asian, roast, dish, sweet, siu, called, chicken, plain, chicken-flavoured, choose, [, cold, Indonesian, Vegetarian, vegetarian, Japanese, low, typical, exceptional, store-bought, marinate, conventional, standard, underground, Hawaiian, cooked, portal"
207,Char kway teow,"Chinese, stir-fried, popular, noodle, national, flat, Cantonese, kway, high, light, dark, small, whole, other, crisp, banana, enhance, noodles.Char, unhealthy, due, fat, low, attractive, cheap, char, supplement, ==, chhá-kóe-tiâu, have, ricecake, usual, actual, ricecake, make, fixed, many, be, 炒貴刁, real, similar, 粿條, char, own, same, basic, main, strips/flat, stir-fry, available, ordinary, religious, standard, exclude, include, extra, broader-width, fried, much, vegetarian, crab, southern, coastal, Burmese, pepper, boiled, yellow, sweet, kut, Asian, such, Many, different, Chinese-style, bright, Good, Indonesian, street, side, generous, sambal, cater, serve, non-Muslim, use, Vietnamese, si-io, orr, inexpensive, healthier, bean, fresh, crunchy, dish, cuttlefish, common, large, expatriate"
208,Chicken feet,"outer, thin, edible, distinct, different, chicken, gelatinous, ==, several, regional, Chinese, be, cold, main, chicken, deep, first, make, puffy, black, fermented, bean, abalone, mainland, popular, such, lu, Sichuanese, garlic, star, bai, feng, extended, southern, raw, huge, other, frozen, direct, major, fresh, green, ===, Russian, Ukrainian, eaten, high, Indonesian, common, serve, traditional, available, clear, yellowish, galangal, turmeric, taste, sambal, lime, street, humble, identical, use, open, reap, prepare, simple, peeled, soft, —, old, nasi, vegetable, rich, beneficial, green/yellow, special, slow, stir-fried, hot, ===, supplementary, Siamese, Many, roti, palm, Malaysian, become, likely, mole, take, chew, inner, uneaten, brown, adidas, athletic, seasoned, soak, =="
209,Chinese sausage,"Chinese, generic, many, different, southern, Cantonese, 'lap, chong, traditional, ==, lean, fresh, turkey, be, main, dried, hard, high, duck, xiāng, plump, chopped, un-rendered, sweet, nuòmǐ, no6, noh, white-colored, glutinous, nuomi, similar, Korean, xuě, primary, popular, northeast, red, Pixian, characterise, special, common, such, fried, lo, unpackaged, wet, famous, ===, regional, smoked, Lithuanian, German, mild, Russian, European, other, Russian-capitalized, Harbin-style, northern, lạp, simple, complex, balance, leaner, u, chicken, pork, meaty, compact, Chinese-Filipino, siopao, native, ===, innovative, low-fat, low-sodium, high-fibre, local, fragrant, kwan, dominant, several, sizeable, snakehead, pla, fatjong, fachongfa-chong, fashong, colloquial, dish, mixed, Other, available, Asian, outside, vacuum-packaged, due, large, mass-produced"
210,Chow mein,"Chinese, traditional, stir-fried, Taishanese, popular, mein, mean, 'stir-fried, sautéed, English, Portuguese, be, ===, American, dish, common, specific, Vegetarian, vegan, main, available, see, crisper, flat, soft, noodles.Crispy, finished, strained, have, many, different, mung, thick, mixed, soy, regional, deep, fried, crispy, few, steamed, separate, lo, used.The, hamburger-style, receive, chop, similar, chop, green, generous, cultural, other, significant, Asian, fit, local, dominant, gravy, canned, Italian, make, acceptable, senior, military, particular, include, noodles.In, first, upon, European, ethnic, keep, expensive, successful, good, several, 'stew-type, guess, great, increase, effective, Australian, dry, stir, sit, underside, serve, single, little, garlic, rice, light, such, bok, chopped, unique, Brazilian, Japanese, [, [, jakisoˈba, North, entire, vegetarian, egg, much, al, heavy, sesame, bean, and/or, yakibifum, same, white, queijo, tofu, spring, bright, red, sweet-sour, Canadian, offer, identical, Cantonese, deep-fried, golden, bamboo, char, Western, substitute, plain, chow, own, dried, Indian, general, South, pork, hot, foreign, owned, Western-style, distinct, shredded, vegetable, sometimes, non-meat, scrambled, chilli, Mexican, past, northwestern, Nepalese, Peruvian, mainstream, contain, crunchy, Indonesian, Malaysian"
211,Chrysanthemum tea,"flower-based, chrysanthemum, popular, prepare, hot, transparent, bright, floral, Chinese, strong, several, first, ==, white, pale, Huángshān-gòngjú, 黄山贡菊, Yellow, gòngjú, prominent, ===, dried, Indian, cold, drained, floor-heated, preserved, mixed, herbal, decoction, be, Commercial, available, many, Asian, various, outside, whole, teabag, tea, Traditional, Korean, portal"
212,Claypot rice,"Chinese, cooked, distinctive, dark, salted, fish, time-consuming, have, wait, ready, ==, tahu"
213,Congee,"popular, many, Asian, side, additional, such, own, ill., thick, prolonged, prominent, ancient, English, have, Portuguese, staple, easy, digest, simple, cook, traditional, Chinese, be, other, hsan, baw, Vietnamese, khao, Japanese, Indonesian, ==, prepare, large, overnight, short-, long-grain, available, regional, cultural, late, suitable, sick, digestible, ဆန်ပြုတ်, thin, plain, chopped, fried, ===, local, Cantonese, make, white, long, use, different, bamboo, Other, provide, similar, Western, oatmeal, brown, common, everyday, therapeutic, unknown, historical, numerous, stretch, feed, young, Often, mixed, steamed, deboned, grow, red, Qing-era, go, build, good, Cambodian, enhance, salted, ឆាខ្វៃ, main, chicken, same, cold, regular, green, dried, few, supernatant, overcooked, prepared, minor, pearl, broken, maize.The, economic, smooth, sago, dry, manual, daily, dish, nachnyachi, pickle.In, roasted, dal, increase, flavour.The, rich, special, medicinal, promote, immune, system.Poor, re-cook, leftover, take, mix-mash, old, previous, poor, re-heated, Indian, —which, south, nombu, turmeric, fenugreek, variant, kocheel, black, ukde, ganji, famous, Fresh, hot, fish, fresh, cooked, vegetables.In, filtered, add, soup-based, little, sour, healthy, separate, certain, undigested, ===, favourite, bubur, ayam, residential, rice, shredded, sweet, yellow, sambal, chili, quail, north, vegetable, tinutuan, spice, ample, lemon, eastern, sago, eaten, lime, okayu, お粥, thicken, umeboshi, pickled, flavor, electric, specific, soft, elderly, first, solid, help, cooked, latter, major, nanakusa-gayu, invite, new, light, heavy, Korean, warm, famine, nutritional, beneficial, get, eat, bad, ideal, forty, basic, flavorful, various, Notable, ground, yulmu-juk, lacryma-jobi, sweetfish, pumpkin, pine, abalone, bean, wet, chicken, [, generic, wide, savory, Chinese-style, dessert, glutinous, Savory, visual, impart, appealing, lugaw, arroz, na, smoked, frog, utak, tongue, soy, digest.Dessert, home-made, refer, binignit, small, immature, strict, former, Singapore-style, early, suit, fixed, lor, stir-fried, kangkong, tau, several, indigenous, medical, millet, kitul, mung, hal, bring, supplementary, bendi, utilized, treat, diarrheal, finger, kurakkan, coconut, sawu, prescribe, kitul, boiling, piti, sweeten, call, aarisi, paal, appropriate, raw, donut-like, sliced, mu, five-spice, notable, kui, Buddhist, vinegar-based, cháo, duck, lòng, congealed, bầu, rural, southern, Well-known, congee, congee, nuanced, nutty, wandering"
214,Conpoy,"seafood, marine, certain, salt-cured, rich, umami, due, high, various, free, such, glutamic, nucleic, inosinic, amino, acid, raw, ==, Cantonese, fish, ==, common, small, Patinopecten, many, preserve, recent, gourmet, strong, distinctive, be, stir, significant, third"
215,Crab rangoon,"cheese, crisp, American, ==, crab, other, small, Chinese, four-pointed, traditional, crispness, vegetable, be, hot, cold, soy, sour, Polynesian-style, authentic, further, same, unclear, cream, nonexistent, unlikely, east, southeast, Asian, puff, wrapper, deep, d'oeuvre"
216,Dan Dan noodles,"dandanmian, traditional, Chinese, noodle, dish, zha, upper, chili, be, dry, added, Taiwanese, American, sesame, mian, specific, Shanghainese, sweeter, ==, dan, sauce, affordable, due, low, local, call, dandan, English, first, dandan, last, Cantonese, Related, same, poached, meat-filled, Sichuan, corresponding, Japanese, 坦, Ta-a, =="
217,Dragonfruit,"several, different, indigenous, fruit, southern, tropical, subtropical, ==, Vernacular, leather-like, prominent, derive, northern, pitahaya, tall, native, ==, sour, arid, important, northwestern, call, ccapxl, related, such, organ, sweet, tart, reminiscent, traditional, leafy, white-fleshed, pink-skinned, white, dragon, red-fleshed, red-skinned, red, yellow, yellow-skinned, reach, Early, certain, taxa, be, unblemished, overripe, potted, shallow, cacti, find, climb, involve, aerial, flower.Commercial, high, take, come, full, commercial, expected.Pitaya, overnight, nocturnal, produce, self-fertile, second, flower, other, healthy, become, own, endure, short, survive, long, thrive, live, dry, moderate, cactus-like, have, 5-6, numerous, invasive, ===, excessive, cause, drop, rot, split, brown, common, Other, fungi, infect, pitaya, black, crunchy, low, nutty, rich, flavor, alcoholic, purple, due, same, amaranth, nutrient, raw, limited, table, fatty, acid, culinary, edible, tunas"
218,Dried cuttlefish,"dried, seafood, coastal, Asian, shredded, ==, common, packaged, Japanese, be, light, many, major, Korean, eat, small, such, dish, stir-frying, chili, popular, gum, different, organic, typical, cold, second, reduced, yellow, brownish, amino, brown, prolonged, Vacuum, nitrogen-filled, increase, want, excessive, prepackaged, keep, tough, own, much, available, certain, next, beef, Cultural, early, Many, cuttlefish, modern-day, haw, mamak, little, daily, olden, large, prepared, westernised, likely, form, traditional, iconic, green, white, fibrous, give, slight, goodly, round, arsenic, other, toxic, squid"
219,Drunken chicken,"alcoholic, many, ==, different, drunken, popular, eastern, historic, create, deep, whole, steamed, Chinese, distilled, chilled, liquor-flavored, traditional, culinary, have, be, recent, huge, marginal, flavour, dish, main, basic, ==, pollo, green, black, chicken, au"
220,Dry-fried green beans,"traditional, Chinese, boiled, such, black, white, optional, thin, final, silken, cooked, different, be, simple-to-prepare, Western, ==, American, main, literal, thicken, ==, common, bean, Japanese, moon-like, whole, responsible, moon, parmesan, popular, garlic, similar, simple, young, sick, mixed, make, small, egg-flour, Polish, kluski, boiling, substantial, chopped, lazy, Ukrainian, frequent, southern, curdle, additional, Make, original, 2012-02-07"
221,Egg drop soup,"deep-fried, American, Chinese, cylindrical, savory, shredded, other, thickly-wrapped, hot, warm, ubiquitous, free, special, take-out, fried, ==, dish, unclear, disputed, distinct, early, 20th, egg, recipe, resemble, modern, vegetable, similar, Cultural, palm, include, main, flour, contain, predominant, eggs, many, native, available, authentic, typical, bumpy, exterior, common, separate, be, cold, Vietnamese, Asian, thinner, popular, overeat.In, romantic, chaotic, large, qualify, musical, guess"
222,Egg rolls,"Cantonese, dan, custard, various, Asian, dish, ==, have, Chinese, English, Portuguese, European, influence, heavy, major, middle, similar, make, simmered, 燉蛋, costly, difficult, puff, tough, invent, new, dessert, weekly, 每週美點, first, introduce, popular, other, follow, Many, own, modern, foreign-influenced, recognizable, basic, egg, coconut, yum, ===, many, white, honey-egg, ginger-flavoured, traditional, green-tea-flavoured, Overall, main, shortcrust, rich, creamy, be, hot, slight, Macanese, famous, ==, simple, Christian, secret"
223,Egg tart,"sugary, sesame, vague, include, Chinese, lucky, lottery, few, distinct, recorded, be, high, other, Western, exact, unclear, various, immigrant, have, early, 20th, Japanese, late, ==, 19th, similar, modern, temple, several, little, small, hollow, first, fortune, settle, key, Smart, federal, much, main, responsible, cakes.Fortune, American, drop, become, many, familiar, ===, legend, ===, false, genuine, expand, vast, large, local, sell, Powerball, same, fast, cook, hot, shape, shaped, right, different, nutritional, 20-30, 5-7, total, contain, significant, overall, Chinese-Peruvian, multi-cultural, Lucky, red, taco-shaped, Italian, original, Asian, go, only, senior, Asian-American, ethnic, English, single, describe, more-or-less, literal, 幸运籤饼, good, bǐng, sweet, 占卜饼, ==, popular, non-Chinese, unfamiliar, hilarious, come, bad, iconic, cookie-shaped, silver-plated, cookie, university, common, [, sexual, bizarre, gallows, 0-446-58007-4, External, Brief, great"
224,Fresh bamboo shoots,"cooked, frying, mixed, other, such, popular, certain, Asian, homemade, fried, countless, economical, same, trace, rice.Many, own, specific, famous, Japanese, Chinese, Korean, general, Indonesian, Malaysian, khao, American, native, Ecuadorian, Peruvian, small, common, find, busy, residential, Many, optional, ==, primary, additional, overnight, fish, extra, Various, vegetable, be, grease, prevent, different, many, Popular, chopped, Cantonese, thick, Fujian, include, stir-fried, garlic, green, red, savory, white, tomato-based, create, yin-yang, generous, barbecued, special, ====, Chinese-derived, myriad, Often, make, stir-frying, wide, whichever, handy, end-of-meal, main, tabletop, seaweed, sesame, kimchi, variable, ===, diced, soy, ====, fried, sweet, kecap, neighboring, nasi, sambal, htamin, Burmese, fragrant, short, dark, ngapi, shredded, fresh, shrimp, eaten, pre-cooked, stale, previous, toasted, black, loose, stick, dry, use, overwhelm, traditional, leftover, due, various, sliced, typical, central, widespread, regional, hot, have, Vietnamese, standard, curry, Nepalese, Sinhalese, ෆ්රයිඩ්, original, basmati, නාසි, cultural, Portuguese, available, Spanish, Chinese-inspired, arroz, local, e.g, similar, dish, lechón, Cuban-style, and/or, responsible, exotic, dried, big, Rican, chau-chau"
225,Fortune cookies,"Cantonese, vegetable, Chinese, flat, glossy, blue-green, thick, similar, cultivar, gai, white, glabrus, hairless, bitter, ==, be, late, early-winter, last, other, yellow, become, tough, lan, stir-fried, common, Vietnamese, Burmese, External"
226,Fried milk,"pronounced, sweet, deep-fried, North, American, other, such, dynasty, military, recorded, dish, have, several, Eileen, Yin-Fei, Chinese, simple, ancestral, Consistent, variant, ===, Taiwan-based, early, 20th-century, Nationalist, official, open, new, traditional, suit, non-Hunanese, local, unique, international, first, serve, stir-fried, hot, old, 65th, whole, see, Hunanese, be, current, crispy, fried, General, unclear, different, way.These, Chinese-American, ==, basic, rice-wine, red, garlic, dark, Regional, main, nautical, original, soy, prominent, typical, include, saturated, 20-30, daily, niacin, recommended, chicken, External"
227,Fried rice,"related, nightshade, native, traditional, Asian, similar, be, small, significant, Japanese, 3rd, herba, modern, official, derived, common, alternative, unproven, ==, Greek, 23-79, 40-90, ancient, unknown, have, mistaken, English-speaking, several, Chinese, technical, botanical, matrimony, chinese, desert-thorn, ==, early, 21st, Western, unsupported, such, fresh, many, whole, commercial, anti-cancer, false, unverified, strong, regulatory, therapeutic, establish, ed, scientific, safe, effective, referenced, therefore, new, prior, goji, investigative, direct-marketing, clinical, prevent, human, deceptive, other, ensure, unheated, raw, educational, novel, poor, numerous, considerable, basic, investigate, possible, medicinal, vitro, unidentified, inhibit, Such, ===, mitigate, permit, organic, dubious.Since, high, fungicide, imported, wolfberry, dried, red, avoid, full, open, mechanical, main, total, nationwide, wolfberries.The, fertile, industrial, promote, export, annual, decorative, first, meet, potential, processed"
228,Gai lan,"jelly-like, bitter, chilled, other, such, bubble, Outside, Asian, ==, several, little, be, mixed, produce, have, hot, fragrant, translucent, black, make, green, require, leaf, leafy, neutral, plain, fresh, leung, Chinese, different, ===, cincau, instant, use, create, Indonesian, mild, enough, distinct, absent, smoky, sugar, various, cold, skin, Various, milk, short, brown, Philippine, sago, ===, xian, boba, traditional, Taiwanese, numerous, azuki, [, natural, toddy, sương, small, additional, sweet, common, Vietnamese, sa, rau, eat, thạch, tào, thạch, liangfen, 'Cultural"
229,General Tso's Chicken,"Hainanese, seasoned, cucumber, southern, national, culinary, ==, chicken, dish, early, Chinese, well-known, important, specific, make, original, overseas, present-day, ’, “, chicken, servant-class, stretch, Japanese, British, first, critic, ubiquitous, ===, Malaysian, other, theirs, re, careful, ‘, become, live, 15-hour, simple, good, boring, beloved, traditional, entire, sub-boiling, cook, produce, jelly-like, dry.The, flavourful, oily, red, garlic, dark, Fresh, light, sesame, serve, additional, ===, nasi, popular, immigration.The, general, refer, multiple, be, side, steamed, offal.In, ball-sized, chopped, common, khao, chicken-fat, free, local, meat, large, scale, fresh, nam, clear, sliced, yellow, thick, vinegar.One, famous, Taiwanese, various, single, Thai, late, native, alternative, Singaporean, successful, romantic, rival"
