,title,description
0,Apple Pie,"whipped, cheddar, double-crust, upper, be, circular, first, whole, prevent, soggy, deep-dish, top, open-face, unofficial, ==, many, different, popular, fresh, dried, final, vary, unavailable, old, include, due, à, sharp, alongside, American, commercially-prepared, 100-gram, other, significant, table, early, van, notable, little, compare, modern, simple, standard, soft, den, deeghe, same, fill, typical, wooden, several, clove, put, dry.Traditional, appeltaart, distinct, lemon, Dutch, such, full-cream, common, recipes.The, tart, mixed, Atop, visible, cover, warm, cold, English, see, good, generous, sweetened, dome, allow, downward, avoid, saggy, cooked.In, English-speaking, eaten, hot, own, ice, double, French, sweet, right, upside, See, traditional, Swedish, crumble, sponge, ==, wait, European, become, fruit-bearing, native, small, sour, likely, make, main, available, 18th, new, 18th-century, historian, aboard, British, published, antebellum, various, nineteenth, twentieth, national, pie-eating, patriotic, Russian, keep, high, commercial, Modern, fluted, have, pecan, unincorporated"
1,Bread,"staple, recorded, prominent, large, man-made, significant, be, such, sourdough, high-pressure, Commercial, improve, essential, religious, secular, modern, Teutonic, High, Proto-Germanic, Polish, Finnish, German, Norwegian, Danish, brew, break, broken, ==, prepared, possible, flat, primitive, old, Natufian, northeastern, ubiquitous, rest, multiple, available, early, Airborne, uncooked, Pliny, produce, other, barm, ancient, wine, begin, common, retain, previous, use, intense, mechanical, reduce, high-energy, low, nutritional, European-derived, wheat-flour, rise, high, bread, single, einkorn, Non-wheat, sorghum, make, wheat, gluten.Gluten-free, gluten-related, coeliac, non-coeliac, benefit, gluten-free, Gluten-free, hold, dense, little, compensate, Physical-chemical, phenolic, insoluble, ferulic, relevant, wheat, fungal, diseases.Rye, dehydrodimers.Three, natural, secoisolariciresinol, p-coumaric, commercial, functional, gluten, disulfide, intrachain, elastic-plastic, same, elastic, able, regain, initial, plastic, non-reversible, structural, certain, applied, gas-in-solid, ===, Culinary, many, Bread, olive, various, sweet, savory, culinary, provide, crunchy, thicken, Nutritional, good, dietary, ===, amino, true, potential, colorectal, unoiled, e.g., contain, straight, dough, accurate, consistent, measurement, dry, flour, important, crumb, Hard, table, textured, light, artisan, yeast, CO2, standard, French, retard, primary, final, all-purpose, develop, extended, finished, water-soluble, water-insoluble, mixed, dissolve, form, wet, long, see, no-knead, thin, chainlike, autolyse, have, liquid, contribute, additional, vegetable, individual, much, divide, fat, leavening, tenderize, preserve, strengthen, increase, enhance, restrict, overall, 20-minute, allow, ==, simple, gas-producing, first, self-raising, second, include, acidic, add, quick, American-style, alcoholic, uniform, reliable, pure, Many, own, right, years.The, flour, Other, bake, rising, punch, let, optional, oven.Many, pre-ferment, ferment, flavorful, starter, minimal, expensive, yeasted, poolish, loose-textured, equal, stiff, pâte, sour, lactic, anaerobic, lactobacilli.Sourdough, lactobacilli, need, added, regular, special, yeast-leavened, peasant, fixed, new, next, rapid, unpredictable, beaten, white, inner, main, small, account, bacterial, require, inconsistent, close, cheese-like, fine, mid, 20th, popular, independent, Pressure-Vacuum, bubble, organic, covert, daily, Cultural, mere, contemporary, basic, general, economic, do, actual, superficial, panem, productive, kapra, aur, English-speaking, remarkable, revolutionary, sliced, English, refer, different, similar, biblical, portal"
2,Ammonia cookie,"Scandinavian-American, =="
3,Cuisine of Antebellum America,"American, different, cultural, create, specific, regional, define, gastronomical, British, due, healthful, average, several, eating, foreign, civilized, heavy, coarse, indigestible, same, good, much, swallow, enormous, available, appreciate, rapid, European, French, undemocratic, serve, local, tangible, republic, only, palpable, agreeable, show, common, republican, own, consistent, ===, many, able, consume, be, great, Hog-eating, such, poor, antebellum, other, fend, feed, preferred, widespread, Virginian, wild, abundant, supply, inconsiderable, first, recollect, have, single, early, turkey.The, complete, important, essential, safe, drink, ====, public, recent, political, Historian, overall, adequate, proper, elite, notorious, responsible, historian, second, down, few, produce, rise, valuable, literary, particular, make, Scotch-Irish, American-made, duty-free, furnish, sturdy, cheap, get, drunk, rest, nutritious, suitable, new, German-type, replace, English-style, personalized, outsell, ====, ===, numerous, Other, shellfish, fish, international, Sicilian, Vietnamese, gargantuan, southern, hospitable, various, lasting, okra, black-eyed, Early, black, preserve, tremendous, accepted, anesthetic, disinfectant, Anglican, Many, ill-prepared, bad, cheat, ==, Technological, large, technological, Labor-saving, mechanical, modern, portal"
4,Apple butter,"concentrated, slow, deep, shelf, first, large, perfect, conserve, own, apple-butter, popular, 19th, actual, butter-like, soft, seasoned, other, baked, add, interesting, historical, lemon, mixed, provide, small, sweet, traditional, table, array.In, due, necessary, produce, Large, stir, take, only, dense, sweeter, Other, similar, Russian, Polish, final, contain, fresh, black, lé, nièr, consist, mashed, red, apple-growing, such, local, be, fat, reduced-fat, fat-free, vegan, ==, white, unrefined, physical, chemical, Soft, creamy, sweet-and-tart, all-purpose, tartness, ideal, ===, natural, Small, reduce, help, bring, available, same, high, low, free, opened, numerous, dependable, ensure, harmful, infect, spoil, tight, hot, main, acid, little, ===, maintain, inhibit, bacterial, destroy, pre-existing, present, important, wary, frozen, specified, maximize, remove, sufficient, kill, high-acid, allow, grow, Similar, large-scale, mechanical, Special, specific, fit, create, secure, get, rid, require, reach, optimum, several, Thermal, characteristic, common, critical, potential, spoilage-causing, illness-causing, thermal, decrease, last, low-temperature, preserve, exist, unable, participate, contribute, Free, perform, above, achieve, support, microbial, pH, favorable, general, include, commercial, fructose, additive, Canadian, capable, possible, observe, survive, speed, Slight, pose, clear, prior, correspond, nutritional, prepare, particular, ingredient, simple, complicated, vary, 4-15, 4-10, good, certain, use, brown, healthy, give, many, accessory, put, dietary, modern, widespread, prepared, appelstroop, typical, approximate, extra, various, mineral, sugar, ==, borne, enter, pre-packaged, moist, dangerous, multiply, germ, harm, verify, prevent, outside, unsealed, slow, different, condiment, pie, marinate, cooked, have, break, thicken, long, golden, liquid, spreadable, apple-harvest, on-site, huge, open, annual, third, official, documentary, original, easy"
5,Apple sauce,"be, flat, unpeeled, such, inexpensive, European, baking.Commercial, available, ==, fresh, required, acidic, render, popular, fine, lemon, similar, high, main, french, notable, dark, cooked, fat, cooking, homemade, combat, help, have, applesauce"
6,Baked potato,"baked, fluffy, be, such, sour, ground, conventional, electric, on/in, open, special, cook, large, keep, warm, ready, clean, washed, olive, escape, split, due, built, internal, unvented, bake, twelve, oven, vent, suitable, standard, help, retain, result, require, prevent, inedible, rich, dietary, lose, slow, vitamin, continue, long, popular, healthy, ==, scoop, white, interior, various, other, warm, varied, thin, proper, luxurious, Regional, side, similar, optional, many, few, ====, major, early, 20th, unable, sell, hogs, single, weigh, vegetable, edible, rough, difficult, cook.Titus, delicious, purchase, produce, first, promote, wink, top, mid-19th, winter, cheese, chili, bonfire.As, mobile, ===, regional, rural, Armenian, slowly, unseasoned, basic, mixed, unsalted, kaşar, Russian, offer, traditional, fast"
7,Barbecue,"Australian, cooking, refer, social, be, large, specially-designed, many, numerous, regional, low, long, several, moderate, average, direct, dry, ribbed, broth-filled, hot, few, ==, other, Spanish, European, first, use, grill, wooden, certain, flavor.Traditional, whole, make, maguey, African, narrative, smoak, slain, flesh, North, American, 1669-70, British, lay, dictionary, following, standard, modern, such, southeastern, noun, roast, southwestern, native, savage, Several, little, true, notable, false, cannibalistic, present, underlying, potential, associate, classic, fast, high, slow, indirect, similar, typical, significant, moderate-to-high, South, southern, Brazilian, 19th, low-maintenance, forage, semi-wild, capture, cook, wild, pig, traditional, own, eastern, vinegar-based, Lexington-style, western, ketchup, only, mustard-based, heavy, tomato-based, tomato-, hickory, finished, sweet, distinctive, white, northern, popular, pulled, City-style, different, burnt, fish—a, attributable, primary, tangy, outdoor, Maryland-style, barbecue, rare, strong, horseradish, preferred, Western, unusual, communal, political, fund-raising, festive, roasted, particular, bring, serve, small, informal, formal, last, Native, main, public, migrate, same, outside, new, competitive, Competitive, compete, barbecue, vary, big, open, distinct, original, various, reach, desired, internal, ===, smoke, common, control, prominent, ===, surround, much, grilled, possible, braise, electric, simmer, soft, textured, regular, effective, radiant, sear, ==, Other, designate, potato"
8,Bear claw (pastry),"bear, sweet, yeast-raised, similar, Danish, curved, rectangular, partial, name.The, common, Western, American, use, be, small, create, claw-like, separate, separate, ==, regional, =="
9,Beef Manhattan,"dish, eastern, western, unlikely, understand, now-defunct, late, open-faced, corner"
10,BK Chicken Fries,"fried, international, be, standard, specific, handle, fit, automotive, expand, sophisticated, present, 24-, 36-year-old, complex, attract, affluent, willing, spend, such, limited, permanent, major, original, legal, nu, intellectual, new, digital-based, multi-media, North, American, heavy, social, help, entice, promote, different, demographic, prominent, few, –, first, global, protect, ==, menu, cater, adult, super, several, other, offer, raise, average, fast, chicken, like, see, reinstate, many, come, comedian, favorable, return, large, third-quarter, massive, primary, positive, utilize, free, interactive, communicate, prefer, due, significant, previous, available, record, all-time, boost, similar, pretzel-style, third, appeal, small, add, prong, stated, introduce, have, impact, former, deliver, limited-time, bring, fortuitous, resounding, domestic, comparable, opposite, same, aggressive, competitive, financial, drive, second, rival, meet, initial, six-, nine-, twelve-piece, thirty-six-piece, six-piece, nine-piece, recommended, pepper-based, black, normal, chief, correct, one-month, successful, enough, consider, ===, sit, hold, make, popular, adult-oriented, take-out, drive-thru, eat, little, trademarked, patented, round, French, honorable, angry, libre-style, Other, ==, late, Miami-based, fictional, various, real-life, own, musical, punk-sounding, viral, four-song, national, Canadian, unable, enter, criminal, ====, lead, Sub-Sonic, digital-focused, online, start, forthcoming, simple, stable, monetary, traditional, multi-week, spread, meme, historical, personal, only, promotional, numerous, personalized, paste, standardized, respond, entire, digitally-based, eighteen-month, digital, firm, early, digital-media, digitally-oriented, sizable, annual, Championship, give, sandwich, co-branded, local, decide, particular, sell, feed, custom-designed, live, upcoming, corporate, one-word, @, become, jaws, perceived, overt, sexual, commercial, nice, last, public, double, clad, sported, request, appropriate, mask-wearing, blatant, appear, want, influence, purchase, desist, undisclosed, fictitious, general, wear, try, achieve, mask-like, near, identical, let, Tie-ins, include, mimic, humorous, Several, in-store, [, circle-R, ], British, wide, European, allow, direct"
11,Blue cheese dressing,"cheese, popular, blue, sour, garlic, salad, seasonings.Most, major, raw, ==, potential, Microbial, common, facultative, acid, survive, low, such"
12,Blue-plate special,"Blue-plate, special, blue, low-priced, common, few, blue-plate, vanishing, American, web, prose, daily, main, ==, unclear, separate, frozen, available, dictionary, inexpensive, similar, such, first, regular, late, Moderate, difficult, dine, get, big, purchasable, last, ten, Little, minor, look, talk, various, vegetable, polite, annoyed, explain, following, contemporary, be, full, whimsical, refined, ===, participatory-theater, good, monthly, free, award-winning, almost-daily, lunch-time, greasy, memorable, wish, work, final, second, amateur, Last, restaurant"
13,Bookbinder soup,"other, tomato-based, typical, such, snapping, several, different, take, make, prepare, s, Jewish, snapper, own, =="
14,Breakfast burrito,"American, flour, several, regional, neighboring, include, scrambled, bacon.Some, such, sell, ==, Mexican, have, original, late, fast, be, Canadian, other, similar"
15,Brunswick stew,"traditional, popular, local, small, unknown, German, ==, tomato-based, various, other, modern, smoky, Eastern, be, tomato, main, early, favor, primary, official, possible, find, same, unique, thick, chicken, dark, pulled, American, old, first, nearby, have, original, =="
16,Buffalo burger,"American, ==, sweet, unique, be, fresh, indistinguishable, buffalo, fat, heart-healthy, high, such, healthy, store, much, 85-gram, 3-ounce, same, simple, low"
17,Buffalo wing,"unbreaded, flat, deep-fried, vinegar-based, hot, blue, cheese, North, American, main, other, spiced, chicken, popcorn, such, Buffalo-style, ==, several, different, inexpensive, undesirable, soup.Several, unannounced, late-night, fast, easy, present, deep, do, Catholic, be, able, eat, spaghetti, unexpected, local, mention, uncut, own, special, good, specialize, same, offer, regular, ===, official, optional, national, next, create, use, buffalo, new, Indian, Other, unique, help, keep, grow, neater, boneless, small, similar, recent, actual, certain, times.In, many, competitive, eating, set, Many, extra-hot, commemorative, free, last, ===, mild, Commercial, varying, cooked, coat, Ranch, popular, sliced, whole, d'oeuvre, regional"
18,Bull roast,"entire, open, similar, pit, exclusive, particular, common, social, //www.bayweekly.com/year99/issue7_33/lead7_33.html, //smartmouthbrewing.com/event/bull-oyster-roast/https"
19,Burnt ends,"flavorful, smoked, lean, first, flat, deep, second, fat, triangular, superficial, traditional, burnt, entire, cooked, whole, Due, cook, tender, render, further, cooks, re-season, top, proper, display, modest, char, be, other, baked, French, portal"
20,Butter cookie,"butter, unleavened, due, necessary, chill, enable, proper, basic, such, pretzel-like, twisted, be, European, ==, Danish, notable, many, particular, industrial"
21,Cajun cuisine,"French, French-speaking, Acadian, British, be, rustic, available, simple, authentic, three-pot, main, steamed, special, seafood, third, plentiful, Crawfish, andouille, staple, aromatic, green, similar, traditional, Characteristic, include, cayenne, black, ==, le, extreme, unable, cook, original, former, culinary, other, become, classic, modern, 20th, elaborate, basic, :23, false, flavorful, true, same, individual, separate, have, :30, slow, low, Southern, indirect, dry, direct, shallow, solid, wide, hollow, narrow, flat, regular, finish, crawfish, seasoned, Deep, vegetable, small, popular, Pan-broiling, pan-frying, large, syringe-type, place, deep, common, oven-roasted, southern, such, historical, partial, ===, short, white, valuable, early, hot, humid, predominant, easy, grow, prepare, bread, many, due, mass-produced, once-common, recent, catfish, wild-caught, red, sweet, several, suit, pickled, olive, gumbo, dark, involved, complicated, flour, desired, nutty, high, burnt, dish, unpalatable, Light, secret, good, strong, overpower, perfect, light, unsuitable, support, orthodox, Cajun, shellfish, unique, Fish, local, and-a, ===, Primary, butcher, natural, better-known, side, spherical, Contrary, non-Cajun, Continental, mean, Native, American, western, principal, distinct, Many, Spanish, Italian, German, Irish, filé, dried, golden, well-browned, ahn-doo-wee, jambalaya, only, certain, else, find, optional, great, pre-Acadian, gravy, brown, pan, extra, extended, let, tough, Popular, chicken, celebratory, newspaper-draped, abundant, shrimp, prepared, suck, abdominal, unfamiliar, eat, dead, live, straight, limp, ====, rural, socialize, play, copious, :111, usable, need, :112, see, female, Rural, 18th, unwelcome, male, collect, festive, preferred, allow, chase, frozen, :113Once, Other, redfish, bell, sweet-dough, thick, stewed"
22,Calf's liver and bacon,"dish, popular, 20th, ==, such, French, American, classic, famous, simple, inexpensive, many, interested, appreciate, new, iron-rich, liver.For, signature, full-page, hearty, good, fuel, heavier, favorite, rendered, Many, be, imperative, hot, aux, copious, =="
23,Carolina style,"hot, classic, chili, fourth, ==, Pan-American"
24,Celery Victor,"historical, American, prepare, mild, portal"
25,Cheese dog,"cheese, hot, stuffed, ==, Cheese, such, American, other, Swiss, be, ==, plain, chili, ===, greasy, jumbo, deep-fried, toasted, consist, ingredient, corned, Russian, Seattle-style, popular, ===, Swiss-style, regional, bratwurst, stuffed, Seattle"
26,Cheese fries,"Cheese, cheesy, latter, fast-food, french, possible, various, other, lunch-, dinner-time, be, exact, grow, cheese, such, have, young, first, serve, ===, Localized, melted, ranch, carne, mega, Swiss, certain, brown, nacho, snack, stand-type, chili, either, American, own, local, taco, fresh, sub, common, French, grated, crumbled, fast, salad, large, garlic, dish, gravy"
27,Cheesesteak,"cheese, sandwich, long, popular, regional, ==, early, 20th, small, chopped, Italian, exact, hot, make, new, interested, focus, steak, own, many, family-run, common, several, fast, be, high-end, Many, ==, sliced, top, other, flat, half.Common, sautéed, ===, cheesesteak, soft, proper, grilled, good, only, agree, fresh, used, cheesesteak.White, American, due, mild, achieve, creamy, discriminating, real, available, original, nephew, processed, familiar, same, runner-up, ten, go, major, chicken, traditional, contain, vegan, such, soy-based, spicy, jalapeno"
28,Chicago-style pizza,"Chicago-style, prepared, several, different, famous, deep-dish, high, ample, large, be, stuffed, ==, Deep-dish, official, cultural, enough, determine, original, primary, other, deep, thick, entire, traditional, thin, medium, similar, typical, allow, easy, create, fried, ordinary, contain, yellowish, baking, burn, cheese, top, upside-down, usual, various, such, solid, patty-like, Other, uncooked, crushed, extra, uncut, become, soggy, frozen, continental, Italian, hard, see, high-sided, additional, small, lid, escape, explode, tomato, Thin-crust, thin-crust, firm, have, noticeable, York-style, tavern, popular, pepperoni, sausage, Great, Chicago-Style"
29,Chicken à la King,"'King-style, dish, diced, ==, Several, early, great, be, white, old, combine, red, green, delight-some, popular, middle, late, 20th"
30,Chicken and waffles,"American, culinary, certain, ==, common, be, such, many, past, popular, become, local, traditional, pulled, exact, unknown, several, origin, European, notable, early, fried, Such, other, due, catfish, limited, seasonal, 19th, attend, waffle, dish, African, eat, familiar, special-occasion, Other, post-Civil, Southern, appear, former, first, suggest, later, Popular, have, real, chicken-and-waffle, =="
31,Chicken Divan,"chicken, early, twentieth, French, great, prepared, regular, classic, American, quick, be, pre-cooked, potato, similar, funeral, ==, imply, attract, signature, exact, know, casserole, regional"
32,Chicken fingers,"chicken, minor, white, major, be, flesh.Chicken, deep, similar, common, original, operate, =="
33,Chicken French,"Italian-American, egg-dipped, sautéed, white, popular, be, Italian, veal, francese, expensive, such, dish, classical, common, chicken"
34,Chicken fried bacon,"bacon, deep, American, early, similar, ==, dish, be, comedian, hard, imagine, artery-clogging, south, recent, country-fried, white, prepared, vegetable, rich, saturated, low-fat, Other, low, nutritional, double-coated, fat, senior, Public, steak, Chocolate-covered"
35,Chicken fried steak,"be, American, cutlet, dish, seasoned, pan-fried, similar, fried, steak, Austrian, tenderized, Scottish, ==, precise, unclear, many, German, 19th, annual, veal, regional, late, chicken-fried, white, numerous, popular, official, thin, other, deep-fried, brown, replace, vegetable, useful, first, dredge, flour, let, sit, half, expensive, desirable, such, flank, chopped, common, serve, baked, deep, thick, traditional, peppered, ==, Other, subject, main, chicken, peppery, top, keep, chicken, center, buffalo"
36,Chicken nugget,"chicken, vegetable, oil.Some, vegetarian, Swedish, ==, unpatented, academic, bite, sized, deep, possible, form, able, hold, handle, frozen, desired, solve, first, make, be, ==, Nutritional, unhealthy, American, different, skeletal, fat, equal, Other, epithelial, nervous, connective, main, common, many, further, correct, automatic, solid, large, cylindrical, outside, specific, vary, true, popular, social, public, feature-length, grade, pre-pubescent, retweeted, take, free, wide"
37,Chicken parmigiana,"chicken, parmesan, Italian, dish, added.The, 20th, eggplant, different, ==, popular, Italian-American, frozen, chicken, other, pre-processed, make, main, Many, take, affordable, be, next, various, colloquial, ==, Similar, ===, underneath, olive, white, usual, similar, fried, french"
38,Chicken sandwich,"skinless, chicken, hot, chicken, ==, be, deep, cold, white, dark, Shredded, such, Open-faced, common, alternative, beef, similar, fried, grilled, ====, unsubstantiated, southern-style, steamed, likely, first, fast, Other, notable, major, casual, ===, Regional, popular, sandwich, au, green, staple, many, believe, have, own, poutine, other, small, working-class, North, American, early, Due, minimal, mid-1900s.This, previous, make, ===, primary, rural, shredded, call, multiple, crushed, help, thicken, bind, economize, covered, dish, tailgate, ==, Make, External"
39,Chili con carne,"chilli, /ˈtʃili, Other, include, garlic, personal, different, basic, frequent, other, Spanish, chili, dry, be, northern, southern, such, barbecued, working-class, famous, previous, inexpensive, chili-flavored, casual, Columbian, popularize, many, first, official, regular, ===, small, family-run, new, secret, due, commercial, late, 19th, Mexican, diner-style, Greek, own, culinary, vibrant, original, sweet, second, operate, chili-topped, Hodge-branded, ==, ===, early, 20th, long, enough, unauthentic, forbidden, marinate, Small, red, pink, common, black-eyed, great, navy, contain, prepared, Commercial, precooked, add, north, Two-Alarm, per, freshly, seal, open, eighteen, medical, wide, popular, diet, make, textured, vegetable, starchy, green, spicy, sauce, slow-cooked, habanero, white, turkey, breast, tomato-based, dish, diced, sour, saltine, tortilla, rolled-up, ==, Pre-made, particular, experienced, lean, local, major, canned, available, vegetarian, widespread, brick, solid, half-brick, rural, American, purchase, dry, cayenne, flavor, hot, chili, french, cheese, same, standard, military, single-serving, top, southwestern, legume, stews, archived, Tex-Mex, [, knowledgeable, well-written, real, ], Catholic, Much, ]"
40,Chili dog,"generic, hot, such, chili, other, multiple, regional, many, specific, unique, regionally, region-specific, ==, Regional, assorted, Greek, due, Western, numerous, longstanding, ===, southeastern, European-style, German, natural, sheep, heart-based, several, local, ===, traditional, small, thin, different, steamed, yellow, seasoned, refer, similar, coarsely-ground, half-pork, half-beef, ==, Brief, /, External"
41,Chimichanga,"Spanish, deep-fried, popular, other, prepared, flour, wide, dried, carne, marinated, rectangular, be, sour, ==, ongoing.The, changa, Mexican, Spanish, past, chinga, third-person, tense, rude, unexpected, small, deep-fat, utter, deep, original, main, retired, mid-1950s.Given, variant, have, third, local, dish, recent, typical, 183-gram, 6.5-ounce, cheese, total, fat, high, snobby, eat, extra, syllable, chimichangas, ==, tortilla-based"
42,Chips and dip,"dish, potato, bean, vegetable, pita, used, whole, sliced, raw, Various, accompany, various, significant, due, French, hold, ==, prepare, sour, create, be, new, similar, unique, several, bread, popular, annual, Eighty-five, corn-based, common, dip, late, chile, side, chili, tortilla, indifferent, other, perform, double, male, double-dip, consume, care, object, double-dipping, transfer, 50-100, prevent, much, few, major, free, interested, ==, main, funeral, celebrate, tray, US6152302, External"
